{
  "$schema": "https://json-schema.org/draft/2020-12/schema",
  "$id": "https://socioprophet.github.io/sociosphere/protocol/workspace-fabric/v0/reconcile-required.schema.json",
  "title": "MountReconcileRequired",
  "type": "object",
  "additionalProperties": false,
  "required": [
    "api_version",
    "kind",
    "workspace_ref",
    "mount_ref",
    "reason_code",
    "authority_mode",
    "resulting_state",
    "correlation_id"
  ],
  "properties": {
    "api_version": {"const": "sourceos.fabric.mount/v0.1"},
    "kind": {"const": "MountReconcileRequired"},
    "workspace_ref": {"type": "string", "minLength": 1},
    "mount_ref": {"type": "string", "minLength": 1},
    "reason_code": {
      "enum": [
        "local_dirty_remote_delete",
        "authority_conflict",
        "stale_mirror_blocked",
        "signed_tombstone_requires_resolution"
      ]
    },
    "authority_mode": {"enum": ["local_first", "provider_first", "hybrid"]},
    "resulting_state": {"const": "RECONCILE_REQUIRED"},
    "correlation_id": {"type": "string", "minLength": 1}
  }
}
